{
  "$schema": "http://json-schema.org/draft-07/schema#",
  "$id": "https://web-harness.local/schemas/design-binding.schema.json",
  "title": "design-binding",
  "description": "공급된 디자인 근거가 어느 기획 단위의 어느 조건에 붙는가. 선언 주체는 사람이며 추론 결과를 적을 어휘가 없다.",
  "type": "object",
  "additionalProperties": false,
  "required": ["schemaVersion", "references", "bindings", "unbound"],
  "properties": {
    "schemaVersion": {"const": 1},
    "references": {
      "type": "array",
      "items": {
        "type": "object",
        "additionalProperties": false,
        "required": ["id", "kind", "locator", "capturedAt"],
        "properties": {
          "id": {"type": "string", "pattern": "^[a-z0-9][a-z0-9-]*$"},
          "kind": {"enum": ["figma-node", "image", "specification"]},
          "locator": {"type": "string", "minLength": 1},
          "capturedAt": {"type": "string", "minLength": 1},
          "snapshot": {"type": "string", "minLength": 1},
          "sha256": {"type": "string", "pattern": "^[0-9a-f]{64}$"}
        },
        "allOf": [
          {
            "$comment": "figma-node는 해시를 낼 수단이 없다 — 계산하지 않은 해시를 적는 것은 위조다. 재현성은 스냅샷 + 가져온 시각이 담보한다.",
            "if": {"properties": {"kind": {"const": "figma-node"}}, "required": ["kind"]},
            "then": {
              "required": ["snapshot"],
              "not": {"required": ["sha256"]},
              "properties": {"locator": {"pattern": "^(?:node-id=)?[0-9]+[:-][0-9]+$"}}
            }
          },
          {
            "$comment": "로컬 원본은 실물이 있으므로 locator가 정본이고 해시는 보강이다. 필수로 두면 계산 수단이 없는 주체가 지어내야만 채울 수 있게 되어 figma-node에서 금지한 바로 그 위조를 유인한다 — 대신 적혀 있으면 collectDesignBinding이 실물과 대조한다.",
            "if": {"properties": {"kind": {"enum": ["image", "specification"]}}, "required": ["kind"]},
            "then": {"not": {"required": ["snapshot"]}}
          }
        ]
      }
    },
    "bindings": {
      "type": "array",
      "items": {
        "type": "object",
        "additionalProperties": false,
        "required": ["pageGroup", "condition", "referenceIds", "declaredBy", "declaredAt"],
        "properties": {
          "pageGroup": {"type": "string", "pattern": "^PAGE-[0-9]{3,}$"},
          "condition": {
            "type": "object",
            "additionalProperties": false,
            "minProperties": 1,
            "properties": {
              "state": {"type": "string", "minLength": 1},
              "modeId": {"type": "string", "pattern": "^[a-z0-9][a-z0-9-]*$"},
              "variant": {"type": "string", "minLength": 1}
            }
          },
          "referenceIds": {
            "type": "array",
            "items": {"type": "string", "pattern": "^[a-z0-9][a-z0-9-]*$"}
          },
          "resolution": {"type": "string", "pattern": "^(?:derive|pending|reuse:[a-z0-9][a-z0-9-]*)$"},
          "declaredBy": {
            "$comment": "어휘에 inferred가 없다 — 이름 유사도로 묶은 결과를 적을 자리를 두지 않는다(I1). 추론은 gap-report의 후보 제시까지다.",
            "enum": ["user", "carried"]
          },
          "declaredAt": {"type": "string", "minLength": 1},
          "note": {"type": "string"}
        },
        "if": {"properties": {"referenceIds": {"maxItems": 0}}, "required": ["referenceIds"]},
        "then": {"required": ["resolution"]},
        "else": {"$comment": "근거가 있으면 해소할 것이 없다.", "not": {"required": ["resolution"]}}
      }
    },
    "unbound": {
      "type": "object",
      "additionalProperties": false,
      "required": ["references", "pageGroups"],
      "properties": {
        "references": {"type": "array", "items": {"type": "string", "pattern": "^[a-z0-9][a-z0-9-]*$"}},
        "pageGroups": {"type": "array", "items": {"type": "string", "pattern": "^PAGE-[0-9]{3,}$"}}
      }
    }
  }
}
